{
  "$schema": "https://json-schema.org/draft/2020-12/schema",
  "$id": "https://example.invalid/schemas/completion-result.schema.json",
  "title": "Completion Result",
  "type": "object",
  "additionalProperties": false,
  "required": [
    "status",
    "summary",
    "filesChanged",
    "validation",
    "limitations"
  ],
  "properties": {
    "status": {
      "enum": [
        "implemented",
        "validated",
        "partially-validated",
        "not-completed"
      ]
    },
    "summary": {
      "type": "string",
      "minLength": 1
    },
    "filesChanged": {
      "type": "array",
      "items": {
        "type": "string"
      },
      "uniqueItems": true
    },
    "risk": {
      "enum": [
        "low",
        "moderate",
        "high",
        "critical"
      ]
    },
    "securityImpact": {
      "type": "string"
    },
    "compatibilityImpact": {
      "type": "string"
    },
    "validation": {
      "type": "array",
      "items": {
        "type": "object",
        "additionalProperties": false,
        "required": [
          "name",
          "result"
        ],
        "properties": {
          "name": {
            "type": "string"
          },
          "result": {
            "enum": [
              "passed",
              "failed",
              "not-run"
            ]
          },
          "evidence": {
            "type": "string"
          }
        }
      }
    },
    "limitations": {
      "type": "array",
      "items": {
        "type": "string"
      }
    },
    "reviewer": {
      "type": "string"
    }
  }
}
